Place_Id,Place_Name,Description,Category,City,Price,Rating,Time_Minutes,Coordinate,Lat,Long,City_1,Harga,Weather,Worthit;
"32,Setu Babakan,""Setu Babakan atau Danau Babakan terletak di Srengseng Sawah, kecamatan Jagakarsa, Kotamadya Jakarta Selatan, Indonesia dekat Depok yang berfungsi sebagai pusat Perkampungan Budaya Betawi, suatu area yang diperuntukkan untuk pelestarian warisan budaya Jakarta, yaitu budaya asli Betawi.\nPerkampungan budaya Betawi ini didirikan pada tanggal 18 Agustus 2000 melalui Surat Keputusan Gubernur DKI Nomor 92 tahun 2000 yang dikeluarkan oleh Gubernur DKI Jakarta pada waktu itu yaitu Sutiyoso\nSitu Babakan merupakan danau buatan dengan area 30 hektare (79 akre) dengan kedalaman 1-5 meter dimana airnya berasal dari Sungai Ciliwung dan saat ini digunakan sebagai tempat wisata alternatif, bagi warga dan para pengunjung.\nTaman disekitarnya ditanami dengan beragam pohon buah-buahan yaitu Mangga, Palem, Melinjo, Rambutan, Jambu, Pandan, Kecapi, Jamblang, Krendang, Guni, Nangka Cimpedak, Nam-nam, dan Jengkol.\nBanyak kuliner khas Betawi terdapat disini, antara lain Kerak Telor, Toge Goreng, Arum Manis, Rujak Bebek, Soto Betawi, Es Potong, Es Duren, Bir Pletok, Nasi Uduk, Nasi Ulam, Lontong Sayur, dll.\nWisata budaya yang disajikan antara laim rumah-rumah khas Betawi yang dibagi menjadi 3 macam, pertama rumah Betawi gudang atau kandang, kedua rumah Betawi Kebaya atau Bapang, dan yang ketiga adalah rumah Joglo, hampir serupa dengan rumah khas Yogyakarta.\nKeseniannya berupa Lenong, Tari Topeng, Tanjidor, Marawis, Gambang Kromong, Tari Lenggang Nyai, dan Tari Narojeng.\nUpacara Adat yang ada di perkampungan Betawi Setu Babakan adalah Penganten Sunat, Pindah Rumah, Khatam Qur'an, dan Nujuh Bulan.\nMayoritas penduduk di Setu Babakan adalah Betawi, dengan program dari pemda DKI untuk memperbaiki sarana dan prasarana yang ada untuk mengakomodasi kebutuhan ruang terbuka hijau, serta area untuk resapan air, setu babakan berbenah diri dengan dukungan penuh dari pemda DKI\nFungsi dari Setu ini bukan hanya untuk tempat melestarikan kebudayaan betawi yang makin tergerus oleh zaman, tetapi digunakan juga sebagai tempat alternatif rekreasi yang berlokasi di selatan jakarta. selain fungsi utamanya sebagai penampung air resapan untuk selatan jakarta,"",Budaya,Jakarta,0,44,,""{'lat': -6.341666699999999, 'lng': 106.8238889}"",-63416667,1068238889,Jakarta Selatan,0,Sunny,0";
"33,Taman Suropati,""Taman Suropati (awalnya bernama Burgemeester Bisschopplein) adalah nama sebuah taman di Jakarta. Pada awalnya nama taman ini diambil dari nama wali kota Batavia pertama, G.J. Bisshop (1916–1920). Taman ini merupakan pusat kawasan Menteng, berada tepat di antara pertemuan tiga jalan utama, yaitu Menteng Boulevard (Jalan Teuku Umar), Orange Boulevard (Jalan Diponegoro), dan Nassau Boulevard (Jalan Imam Bonjol). Lapangan yang kini disebut sebagai Taman Suropati ini sejak tahun 1920 sudah menggantikan lapangan bundar yang luas dalam Rencana Moojen. Taman Suropati, yang disebut-sebut sebagai titik nol Republik Indonesia, menjadi taman yang rindang dan sejak beberapa tahun yang lalu dihiasi dengan patung-patung karya pematung dari negara-negara pendiri Perhimpunan Bangsa-Bangsa Asia Tenggara."",Taman Hiburan,Jakarta,0,46,,""{'lat': -6.1994034, 'lng': 106.8326228}"",-61994034,1068326228,Jakarta Pusat,0,Sunny,0";
"34,Pasar Taman Puring,""Taman Puring bukanlah taman secara harfiah. Sejak eksis di tahun 1960 silam, Taman Puring adalah sebuah pasar. Selama bertahun-tahun, pasar ini sempat menjadi pasar gelap alias pasar barang-barang ilegal. Antara tahun 1980-1990an, pasar ini makin dijauhi masyarakat karena menjadi sentra barang-barang hasil tindakan kriminal. Sejak terbakar pada 2002, Pasar Taman Puring perlahan berbenah diri hingga sekarang menjadi destinasi belanja akhir pekan favorit warga Jakarta. Ada ratusan kios sepatu pria mulai dari sepatu kulit, sepatu gunung, sepatu futsal, hingga sepatu gaul khas anak muda. Beragam merk mulai dari Adidas, Caterpillar, Nike, Karrimor, Vans, hingga Converse tersedia dalam berbagai model dan warna."",Pusat Perbelanjaan,Jakarta,0,44,60,""{'lat': -6.241368999999999, 'lng': 106.7890587}"",-6241369,1067890587,Jakarta Selatan,0,Sunny,0";
"35,Grand Indonesia Mall,""Grand Indonesia merupakan mal di Jakarta. Mal ini dibuka pada tahun 2007 oleh Presiden Susilo Bambang Yudhoyono. Pada tahun 2007, Hotel Indonesia mengalami pemugaran. Selanjutnya setelah dibuka kembali, hotel dikelola oleh grup Kempinski dan namanya diganti menjadi Hotel Indonesia-Kempinski."",Pusat Perbelanjaan,Jakarta,0,47,120,""{'lat': -6.195180099999999, 'lng': 106.8204412}"",-61951801,1068204412,Jakarta Pusat,0,Rain,0";
"36,Skyrink - Mall Taman Anggrek,Salah satu arena ice skating Jakarta adalah Ice Skating Taman Anggrek. Area ice skating di Taman Anggrek dibuat seluas 1.248 meter persegi. Ice Skating Termegah Di Indonesia adalaH di Taman Anggrek. Tidak hanya termegah di Indonesia tetapi juga termegah di Asia.Maka dari itu tidak mengherankan bahwa banyak sekali pengunjung yang datang.,Taman Hiburan,Jakarta,110000,45,180,""{'lat': -6.178996, 'lng': 106.791941}"",-6178996,106791941,Jakarta Barat,1,Rain,0";
"37,Bumi Perkemahan Cibubur,""Bumi Perkemahan dan Graha Wisata Pramuka Cibubur (Buperta Cibubur) adalah kawasan perkemahan yang terdapat di Cibubur, Ciracas, Jakarta Timur. Kawasan ini memiliki luas 210 hektar dan sudah berkali-kali menjadi lokasi pelaksanaan Jambore Nasional sejak tahun 1973. Buperta Cibubur dibangun di kawasan yang sebelumnya merupakan hutan karet. Pihak pengelola juga bekerja sama dengan TNI AD dan TNI AU dalam pengelolaan Buperta Cibubur.Buperta Cibubur dapat diakses dari Terminal Kampung Rambutan dengan angkutan umum jurusan Kranggan atau Mekarsari Jonggol."",Taman Hiburan,Jakarta,10000,45,,{'lat': -6.360248700000001, 'lng': 106.893842}"",-63602487,106893842,Jakarta Timur,0,Sunny,0";
"38,Istana Negara Republik Indonesia,""Istana Negara merupakan pusat kegiatan pemerintahan negara. Banyak kegiatan-kegiatan bersifat kenegaraan digelar di Istana Negara. Seperti kegiatan pelantikan pejabat-pejabat penting negara, maupun pembukaan kongres bersifat nasional dan internasional. Istana Negara fungsinya lebih difokuskan kepada kegiatan resmi kepresidenan, yaitu sebagai kantor Presiden Republik Indonesia. Dilansir situs Sekretaris Negara (Sesneg), Istana Negara awalnya sebagai kediaman pribadi warga Belanda, J.A Van Braam."",Budaya,Jakarta,0,46,,""{'lat': -6.168069000000001, 'lng': 106.8239727}"",-6168069,1068239727,Jakarta Pusat,0,Sunny,0";
"39,Museum Macan (Modern and Contemporary Art in Nusantara),""Museum Seni Modern dan Kontemporer di Nusantara atau Museum MACAN adalah sebuah museum seni di Kebon Jeruk di Jakarta, Indonesia. Museum ini merupakan yang pertama di Indonesia yang memiliki koleksi seni modern dan kontemporer Indonesia dan internasional."",Budaya,Jakarta,100000,45,120,""{'lat': -6.190942, 'lng': 106.767622}"",-6190942,106767622,Jakarta Barat,1,Rain,0";
"40,Galeri Nasional Indonesia,""Galeri Nasional Indonesia (bahasa Inggris: National Gallery of Indonesia) adalah sebuah lembaga budaya negara atau sebagai museum seni rupa modern dan kontemporer. Di sini terdapat gedung yang berfungsi antara lain sebagai tempat pameran, dan perhelatan seni rupa Indonesia dan mancanegara. Gedung ini merupakan institusi milik pemerintah di bawah Menteri Pendidikan dan Kebudayaan. Fungsi Galeri Nasional Indonesia adalah melaksanakan pengkajian, pengumpulan, registrasi, perawatan, pengamanan, pameran, kemitraan, layanan edukasi dan publikasi karya seni rupa. Lalu fungsi utamanya adalah melindungi, pengembangan, dan pemanfaatan asset kesenian (seni rupa) sebagai fasilitas pendidikan dan kebudayaan. Galeri Nasional beralamat di Jalan Medan Merdeka Timur No. 14 Jakarta Pusat."",Budaya,Jakarta,0,46,,{'lat': -6.178548200000001, 'lng': 106.8327716}"",-61785482,1068327716,Jakarta Pusat,0,Rain,0";
"41,Museum Bahari Jakarta,Museum Bahari adalah museum yang menyimpan koleksi yang berhubungan dengan kebaharian dan kenelayanan bangsa Indonesia dari Sabang hingga Merauke yang berlokasi di seberang Pelabuhan Sunda Kelapa. Museum adalah salah satu dari delapan museum yang berada di bawah pengawasan dari Dinas Kebudayaan Permuseuman Provinsi Daerah Khusus Ibu kota Jakarta.,Budaya,Jakarta,2000,44,120,""{'lat': -6.1269553, 'lng': 106.8085899}"",-61269553,1068085899,Jakarta Utara,0,Rain,0";
"42,Museum Seni Rupa dan Kramik,""Museum Seni Rupa dan Keramik (Indonesia: Museum Seni Rupa dan Keramik) adalah sebuah museum di Jakarta, Indonesia. Museum ini didedikasikan khusus untuk menampilkan seni rupa tradisional dan keramik Indonesia. Museum ini terletak di sisi timur Lapangan Fatahillah, dekat Museum Sejarah Jakarta dan Museum Wayang."",Budaya,Jakarta,5000,44,,""{'lat': -6.1342598, 'lng': 106.814552}"",-61342598,106814552,Jakarta Barat,0,Rain,0";
"43,The Escape Hunt,""Escape Hunt adalah salah satu tempat rekreasi yang lokasinya terletak di Jakarta Selatan. Di tempat ini, kamu akan berperan sebagai seorang detektif yang berada di sebuah ruangan terkunci dan hanya diberikan waktu 1 jam untuk memecahkan teka-teki yang ada. Tidak perlu khawatir atau takut sendirian, karena di sini kamu bisa mengajak hingga 4 temanmu dalam satu ruangan yang sama dan memecahkan kasus bersama-sama. Menarik sekali, bukan? Pertama kali datang di tempat ini, kamu akan dituntun untuk mengisi data di formulir yang telah disediakan dan diberikan briefing oleh pemandu game mengenai jalan cerita tema/kasus yang sudah kamu tentukan."",Taman Hiburan,Jakarta,70000,44,120,""{'lat': -6.2555033, 'lng': 106.8122591}"",-62555033,1068122591,Jakarta Selatan,1,Rain,0";
"44,Monumen Selamat Datang,""Monumen Selamat Datang adalah sebuah monumen yang terletak di tengah Bundaran Hotel Indonesia, Jakarta, Indonesia. Monumen ini berupa patung sepasang manusia yang sedang menggenggam bunga dan melambaikan tangan. Patung tersebut menghadap ke utara yang berarti mereka menyambut orang-orang yang datang dari arah Monumen Nasional."",Budaya,Jakarta,0,47,15,{'lat': -6.194997799999999, 'lng': 106.8230496}"",-61949978,1068230496,Jakarta Pusat,0,Sunny,0";
"45,Jakarta Aquarium dan Safari,""Jika telah mengunjungi Seaworld Ancol, mungkin sudah tidak asing lagi dengan serunya menyaksikan biota laut. Jika belum puas, pengunjung dapat mencoba mengunjungi wisata satwa laut unik di Jakarta Aquarium. Jakarta Aquarium menempati areal seluas ±7000 m2 ini menawarkan atraksi wisata laut modern yang tidak hanya menghibur, juga edukatif. Meskipun tidak seluas SeaWorld Ancol, taman rekreasi ini juga menawarkan wahana dan atraksi yang tak kalah menariknya."",Taman Hiburan,Jakarta,185000,46,,""{'lat': -6.1752647, 'lng': 106.7904684}"",-61752647,1067904684,Jakarta Selatan,1,Rain,0";
"46,Pulau Semak Daun,""Pulau Semak Daun merupakan salah satu pulau yang terletak digugusan kepulauan Seribu. Secara administratif pulau ini termasuk dalam wilayah kabupaten Kepulauan Seribu provinsi DKI Jakarta sebagai daerah penangkaran penyu sisik dengan pantai yang nyaman untuk berenang karena pantainya yang bersih dan landai, berpasir putih, dan bebas bulu babi, terdapat pula daerah yang bagus untuk menyelam dan snorkeling pemula dan letaknya tidak jauh dari pulau Pramuka."",Bahari,Jakarta,40000,4,,""{'lat': -5.729671599999999, 'lng': 106.5714158}"",-57296716,1065714158,Kepulauan Seribu,0,Sunny,1";
"47,Taman Situ Lembang,""Taman Situ Lembang adalah sebuah taman kota yang terletak di pusat Jakarta. Situ berarti danau yang payau, sedangkan Lembang adalah nama jalan yang berada di dekat taman tersebut..\nTaman ini merupakan salah satu taman tertua di Jakarta dan memiliki danau kecil yang airnya berasal dari sumber air alam. Di taman ini terletak fasilitas arena pemancingan, trek lari, dan arena permainan anak. Taman Situ Lembang dikelilingi oleh rumah-rumah di kawasan elite Menteng"",Taman Hiburan,Jakarta,0,45,,""{'lat': -6.1978861, 'lng': 106.8346708}"",-61978861,1068346708,Jakarta Barat,0,Sunny,0";
"48,Taman Ismail Marzuki,""Pusat Kesenian Jakarta Taman Ismail Marzuki yang populer disebut Taman Ismail Marzuki (TIM) merupakan sebuah pusat kesenian dan kebudayaan yang berlokasi di jalan Cikini Raya 73, Jakarta Pusat. Di sini terletak Institut Kesenian Jakarta dan Planetarium Jakarta. Selain itu, TIM juga memiliki enam teater modern, balai pameran, galeri, gedung arsip, dan bioskop. Acara-acara seni dan budaya dipertunjukkan secara rutin di pusat kesenian ini, termasuk pementasan drama, tari, wayang, musik, pembacaan puisi, pameran lukisan dan pertunjukan film. Berbagai jenis kesenian tradisional dan kontemporer, baik yang merupakan tradisi asli Indonesia maupun dari luar negeri juga dapat ditemukan di tempat ini. Nama pusat kesenian ini berasal dari nama pencipta lagu terkenal Indonesia, Ismail Marzuki."",Budaya,Jakarta,5000,46,,""{'lat': -6.1891586, 'lng': 106.8397738}"",-61891586,1068397738,Jakarta Pusat,0,Sunny,0";
"49,Galeri Indonesia Kaya,""Galeri Indonesia Kaya (disingkat GIK) adalah ruang publik yang memadukan konsep edukasi dan digital dengan tujuan untuk memperkenalkan dan mengapresiasi seni-budaya Indonesia khususnya kepada generasi muda, yang bertempat di Grand Indonesia, Jakarta, Indonesia. Galeri Indonesia Kaya digagas dan dibangun untuk menjadi ruang edutainment budaya berbasis teknologi digital yang dapat mendekatkan dan menyalurkan kreativitas berekspresi generasi muda dalam lingkup tradisi budaya nusantara. Tempat ini memiliki auditorium yang dapat digunakan untuk masyarakat yang membutuhkan tempat berkarya."",Budaya,Jakarta,0,48,90,""{'lat': -6.1948499, 'lng': 106.8200607}"",-61948499,1068200607,Jakarta Pusat,0,Rain,0";
"50,Museum Joang 45,""Gedung Joang '45 atau Museum Joang 45 adalah salah satu museum yang berada di Jakarta. Saat ini pengelolaannya dilaksanakan oleh Dinas Pariwisata dan Kebudayaan Provinsi DKI Jakarta. Museum ini terletak di Jalan Menteng Raya 31, Kelurahan Kebon Sirih, Kecamatan Menteng, Jakarta Pusat. Museum ini diresmikan pada tahun 1974 oleh Presiden Soeharto, setelah dilakukan renovasi."",Budaya,Jakarta,2000,4,,""{'lat': -6.186183799999998, 'lng': 106.8364761}"",-61861838,1068364761,Jakarta Pusat,0,Rain,1";
"51,Jakarta Planetarium,""Planetarium dan Observatorium Jakarta adalah satu dari tiga wahana simulasi langit di Indonesia selain di Kutai, Kalimantan Timur, dan Surabaya, Jawa Timur. Planetarium tertua ini letaknya di Taman Ismail Marzuki, Jakarta. Planetarium Jakarta merupakan sarana wisata pendidikan yang dapat menyajikan pertunjukan / peragaan simulasi perbintangan atau benda-benda langit. Pengunjung diajak mengembara di jagat raya untuk memahami konsepsi tentang alam semesta melalui acara demi acara. Planetarium Jakarta berdiri tahun 1964 diprakarsai Presiden Soekarno dan diserahkan ke Pemerintah Provinsi DKI Jakarta pada 1969. Di tempat ini juga tersedia ruang pameran benda- benda angkasa yang menyuguhkan berbagai foto serta keterangan lengkap dari berbagai bentuk galaksi, teori-teori pembentukan galaksi disertai pengenalan tokoh-tokoh di balik munculnya teori."",Taman Hiburan,Jakarta,12000,41,120,""{'lat': -6.190081899999999, 'lng': 106.8388532}"",-61900819,1068388532,Jakarta Pusat,0,Rain,1";
"52,Kampung Cina,""KAMPUNG China adalah hunian dan kawasan perdagangan di Cibubur, Jakarta Timur. Wilayah ini berdiri berkat kerja sama antara Pemerintah Kota Jakarta Timur dengan perusahaan asing untuk menyulap area 300 hektare kawasan wisata Cibubur menjadi kota wisata, mandiri dan town center. Mengutip buku Ensiklopedia Jakarta, kampung itu mulai beroperasi pada tanggal 14 September 2002. Bangunan, nuansa alam, sampai pernak-pernik yang dijual masih berbau kesenian China. Semua produk yang dijajahkan pun berasal dari negeri tirai bambu tersebut. Wilayah itu akan menjadi tujuan wisata pada setiap perayaan hari raya Imlek."",Budaya,Jakarta,15000,45,,{'lat': -6.3651357, 'lng': 106.7617984}"",-63651357,1067617984,Bogor,0,Sunny,0";
"53,Rumah Sipitung,""Rumah Si Pitung di Marunda, Jakarta Utara, Indonesia, merupakan satu dari sedikit rumah panggung Betawi yang tersisa. Rumah panggung ini merupakan representasi hunian panggung masyarakat Betawi yang tinggal di wilayah-wilayah Pesisir. Rumah ini menjadi museum dan masuk dalam cagar budaya. Tidak diketahui kapan persisnya Rumah Si Pitung didirikan. Diperkirakan bangunan tersebut dibangun pada abad ke-20. Rumah panggung yang sering juga disebut Rumah Tinggi Marunda ini mirip dengan rumah tradisional Suku Bugis. Rumah ini tadinya milik Haji Saipudin, seorang saudagar kaya bandar ikan asal Makassar (sumber lain mengatakan Haji Saipudin adalah juragan sero, atau konglomerat kapal). Haji Saipuddin diyakini merupakan sahabat erat Si Pitung. Pitung ditengarai hanya beberapa kali singgah di rumah itu (diperkirakan pada dasawarsa 1890-an). Singgahnya Si Pitung terakhir kali adalah dalam rangka bersembunyi dari kejaran tentara Belanda dengan tuduhan merampok. Pemerintah DKI Jakarta pertama kali memugar rumah panggung yang ditopang oleh 40 buah tiang itu pada tahun 1972. Sebelumnya pada tahun yang sama bangunan ini dibeli oleh Pemprov DKI Jakarta dari keturunan (ahli waris) H. Saipudin. Bangunan tersebut kini menjadi museum dan masuk dalam cagar budaya berdasarkan SK Gubernur No.475 tahun 1993 dan SK Menteri No.140/M/1998. Lembaga yang memberi nama rumah asli Betawi Pesisir ini sebagai rumah Si Pitung adalah Museum Nasional."",Budaya,Jakarta,5000,45,90,""{'lat': -6.10016, 'lng': 106.96057}"",-610016,10696057,Jakarta Utara,0,Sunny,0";
"54,Taman Agrowisata Cilangkap,""Taman seluas sekitar 19 hektar ini dimiliki oleh pemerintah Provinsi (Pemprov) DKI Jakarta yang dikelola oleh Dinas Pertanian dan Kehutanan DKI. Taman Wisata Agro Cilangkap ini terletak di Jalan Raya Cilangkap No.45, Jakarta Timur. Taman ini terasa begitu permai dengan tumbuhnya aneka jenis pepohonan rindang. Kesejukan udara yang jauh dari polusi asap kendaraan bermotor, juga dapat dinikmati di taman yang dijadikan alternatif destinasi wisata bagi warga berdomisili di sekitar kawasan tersebut. Taman Wisata Agro Cilangkap juga dilengkapi dengan beberapa fasilitas seperti arena olahraga, jogging track, arena bermain anak, serta bagi sobat Ayojakarta yang memiliki hobi memancing, di sekitar area taman memiliki danau yang biasanya dijadikan area untuk memancing."",Taman Hiburan,Jakarta,0,42,,""{'lat': -6.340151399999999, 'lng': 106.9012561}"",-63401514,1069012561,Jakarta Timur,0,Sunny,1";
"55,Klenteng Jin De Yuan,""Kelenteng Kim Tek Le, atau yang lebih dikenal dengan Kelenteng Jin De Yuan, sudah dibangun sejak 1650. Kelenteng yang disebut-sebut sebagai yang tertua di Jakarta ini didirikan oleh seorang Letnan Tionghoa, Kwee Hoen dan awalnya dinamakan Koan Im Teng. Jin De Yuan juga dikenal sebagai salah satu dari empat kelenteng besar yang dikelola oleh Kong Koan atau Dewan Tionghoa. Mereka adalah Kelenteng Goenoeng Sari, Kelenteng Toa Peh Kong, Kelenteng Jin De yuan sendiri, dan Kelenteng Hian Thian Shang di Tanah Tandjoeng yang kini sudah musnah."",Tempat Ibadah,Jakarta,0,45,,""{'lat': -6.144473700000001, 'lng': 106.8126018}"",-61444737,1068126018,Jakarta Barat,0,Sunny,0";
"56,Pantai Ancol,""Pantai Ancol merupakan kawasan wisata yang merupakan destinasi wisata pantai dalam kota Jakarta. Wisatawan dapat menikmati suasana segar Pantai Lagoon, Festival, Indah, Beach Pool dan Carnaval, serta Danau Impian. Berlibur di alam terbuka dipercaya memiliki efek menenangkan dan menyenangkan. Panjang garis pantainya yang kurang lebih 6,5 km menjadi tempat berbagai aktivitas wisata. Wisata pantai ini merupakan BUMD penghasil Pendapatan Asli Daerah kedua terbesar bagi provinsi DKI Jakarta."",Bahari,Jakarta,25000,44,,""{'lat': -6.1194215, 'lng': 106.8502435}"",-61194215,1068502435,Jakarta Utara,0,Sunny,0";
"57,Taman Lapangan Banteng,""Lapangan Banteng, dulu bernama Waterlooplein (bahasa Belanda: plein = lapangan) yaitu suatu lapangan yang terletak di Weltevreden, Batavia";" tidak jauh dari Gereja Katedral Jakarta. Pada masa itu, Lapangan Banteng dikenal dengan sebutan Lapangan Singa[1] karena di tengahnya terpancang tugu peringatan kemenangan pertempuran di Waterloo, dengan patung singa di atasnya. Pertempuran Waterloo tersebut terjadi tanggal 18 Juni 1815 di dekat kota Waterloo, yaitu sekitar 15 km ke arah selatan dari ibu kota Belgia, Brussels. Pertempuran itu merupakan pertempuran terakhir Napoleon melawan pasukan gabungan Inggris-Belanda-Jerman. Pertempuran ini juga dicatat dalam sejarah sebagai penutup dari seratus hari sejak larinya Napoleon dari pengasingannya di pulau Elba. Sedangkan Tugu Singa tersebut didirikan pada zaman pemerintahan pendudukan tentara Jepang (1942-1945). Setelah Indonesia merdeka, namanya diganti menjadi Lapangan Banteng. Terdapat kemungkinan pada zaman dahulu tempat yang kini menjadi lapangan itu dihuni berbagai macam satwa liar seperti macan, kijang, dan banteng. Pada waktu J.P. Coen membangun kota Batavia di dekat muara Ciliwung, lapangan tersebut dan sekelilingnya masih berupa hutan belantara yang sebagian berpaya–paya. Sebelah timur dijalan Lapangan banteng timur tedapat Kantor Satlantas Polres jakarta Pusat."",Taman Hiburan,Jakarta,0,47,,""{'lat': -6.170554999999999, 'lng': 106.8350378}"",-6170555,1068350378,Jakarta Pusat,0,Sunny,0"
"58,Taman Ayodya,""Taman Ayodya, yang dulu bernama Taman Barito, adalah sebuah taman kota yang berada di Jakarta Selatan. Taman ini berlokasi di atas lahan seluas 7.500 m2, dilengkapi dengan kolam buatan seluas 1.500 m2 di tengahnya.\nTaman Ayodya juga dilengkapi dengan jalur pijakan, kursi, gazebo, pendopo, kamar mandi, serta trek jogging.. Di dekat taman ini terdapat hotel dan pasar seperti Hotel Gran Mahakam, Plaza Blok M, Pasar Burung Barito, Mal Kebayoran Baru, dan Pasar Taman Puring.\nTaman ini bersebelahan dengan Taman Langsat hanya dengan menyebrang jalan raya saja."",Taman Hiburan,Jakarta,0,44,45,""{'lat': -6.245229400000001, 'lng': 106.7946655}"",-62452294,1067946655,Jakarta Selatan,0,Sunny,0";
"59,Museum Sumpah Pemuda,""Museum Sumpah Pemuda adalah sebuah museum sejarah perjuangan kemerdekaan Republik Indonesia yang berada di Jalan Kramat Raya No. 106, Jakarta Pusat dan dikelola oleh Kementerian Pendidikan dan Kebudayaan Republik Indonesia. Museum ini dibuka untuk umum, setiap hari Selasa sampai dengan Jumat dari pukul 08.00 hingga 16.00 UTC+7, setiap Sabtu dan Minggu pada pukul 08.00—16.00 WIB, dan setiap hari Senin dan hari besar nasional, museum ini ditutup untuk umum.\nMuseum ini memiliki koleksi foto dan benda-benda yang berhubungan dengan sejarah Sumpah Pemuda 1928, serta kegiatan-kegiatan dalam pergerakan nasional kepemudaan Indonesia. Museum Sumpah Pemuda ini didirikan berdasarkan SK Gubernur DKI Jakarta pada tahun 1972 dan menjadi benda cagar budaya nasional."",Budaya,Jakarta,2000,47,,{'lat': -6.183838799999999, 'lng': 106.8430507}"",-61838388,1068430507,Jakarta Pusat,0,Rain,0";
"60,Museum Tekstil,""Museum cinta Tekstil menempati gedung tua di Jalan K.S. Tubun / Kota Bambu Selatan No. 4 Kecamatan Palmerah, Jakarta Barat\n\nGedungnya sendiri pada mulanya adalah rumah pribadi seorang warga negara Prancis yang dibangun pada abad ke-19. Kemudian dibeli oleh konsul Turki bernama Abdul Azis Almussawi Al Kazimi yang menetap di Indonesia. Selanjutnya tahun 1942 dijual kepada Dr. Karel Christian Cruq.\nPada masa perjuangan kemerdekaan Indonesia, gedung ini menjadi markas Barisan Keamanan Rakyat (BKR) dan tahun 1947 didiami oleh Lie Sion Pin. Pada tahun 1952 dibeli oleh Departemen Sosial dan pada tanggal 25 Oktober 1975 diserahkan kepada Pemda DKI Jakarta yang untuk kemudian pada tanggal 28 Juni 1976 diresmikan penggunaannya oleh Ibu Tien Soeharto sebagai Museum Tekstil."",Budaya,Jakarta,5000,45,45,""{'lat': -6.187963400000002, 'lng': 106.8096081}"",-61879634,1068096081,Jakarta Barat,0,Rain,0";
"61,Tugu Proklamasi,""Tugu Proklamasi adalah tugu peringatan proklamasi kemerdekaan Republik Indonesia yang berdiri di kompleks Taman Proklamasi di Jalan Proklamasi, Jakarta Pusat. Taman tersebut berlokasi di bekas kediaman Sukarno di Jalan Pegangsaan Timur 56. Rumah tersebut, telah dihancurkan, adalah lokasi pembacaan proklamasi kemerdekaan.Pada kompleks juga terdapat monumen dua patung Sukarno-Hatta berukuran besar yang berdiri berdampingan, mirip dengan dokumentasi foto ketika naskah proklamasi pertama kali dibacakan. Di tengah-tengah dua patung proklamator terdapat patung naskah proklamasi terbuat dari lempengan batu marmer hitam, dengan susunan dan bentuk tulisan mirip dengan naskah ketikan aslinya."",Budaya,Jakarta,0,46,,""{'lat': -6.2030468, 'lng': 106.8466623}"",-62030468,1068466623,Jakarta Pusat,0,Sunny,0";
"62,Taman Legenda Keong Emas,""Taman Legenda Keong Emas merupakan salah satu tempat rekreasi favorit yang ada di kawasan Jakarta Timur. Berada di dalam lokasi Taman Mini Indonesia Indah atau TMII, Taman Legenda Keong Emas TMII juga telah menjadi ikon di dalam pusat sarana wisata terbesar di Indonesia ini. Selain sebagai sarana rekreasi untuk seluruh keluarga, Taman Legenda Keong Emas TMII juga mempunyai visi dan misi untuk mengedukasi masyarakat sekaligus melestarikan warisan kebudayaan Indonesia, salah satunya melalui legenda cerita rakyat."",Taman Hiburan,Jakarta,30000,45,,""{'lat': -6.303904200000001, 'lng': 106.8936219}"",-63039042,1068936219,Jakarta Timur,0,Sunny,0";
