Place_Id,Place_Name,Description,Category,City,Price,Rating,Time_Minutes,Coordinate,Lat,Long,City_1,Harga,Weather,Worthit;
"1,Monumen Nasional,""Monumen Nasional atau yang populer disingkat dengan Monas atau Tugu Monas adalah monumen peringatan setinggi 132 meter (433 kaki) yang didirikan untuk mengenang perlawanan dan perjuangan rakyat Indonesia untuk merebut kemerdekaan dari pemerintahan kolonial Hindia Belanda. Pembangunan monumen ini dimulai pada tanggal 17 Agustus 1961 di bawah perintah presiden Soekarno dan dibuka untuk umum pada tanggal 12 Juli 1975. Tugu ini dimahkotai lidah api yang dilapisi lembaran emas yang melambangkan semangat perjuangan yang menyala-nyala. Monumen Nasional terletak tepat di tengah Lapangan Medan Merdeka, Jakarta Pusat."",Budaya,Jakarta,20000,46,15,""{'lat': -6.1753924, 'lng': 106.8271528}"",-61753924,1068271528,Jakarta Pusat,0,Sunny,0";
"2,Kota Tua,""Kota tua di Jakarta, yang juga bernama Kota Tua, berpusat di Alun-Alun Fatahillah, yaitu alun-alun yang ramai dengan pertunjukan rutin tarian tradisional. Museum Sejarah Jakarta adalah bangunan era Belanda dengan lukisan dan barang antik, sedangkan Museum Wayang memamerkan boneka kayu khas Jawa. Desa Glodok, atau Chinatown, terkenal dengan makanan kaki lima, seperti pangsit dan mi goreng. Di dekatnya, terdapat sekunar dan kapal penangkap ikan di pelabuhan Sunda Kelapa yang kuno"",Budaya,Jakarta,0,46,90,""{'lat': -6.137644799999999, 'lng': 106.8171245}"",-61376448,1068171245,Jakarta Barat,0,Sunny,0";
"3,Dunia Fantasi,""Dunia Fantasi atau disebut juga Dufan adalah tempat hiburan yang terletak di kawasan Taman Impian Jaya Ancol, Jakarta Utara, Indonesia. Dufan diresmikan dan dibuka pada tanggal 29 Agustus 1985."",Taman Hiburan,Jakarta,270000,46,360,""{'lat': -6.125312399999999, 'lng': 106.8335377}"",-61253124,1068335377,Jakarta Utara,1,Sunny,0";
"4,Taman Mini Indonesia Indah (TMII),""Taman Mini Indonesia Indah merupakan suatu kawasan taman wisata bertema budaya Indonesia di Jakarta Timur. Area seluas kurang lebih 150 hektare atau 1,5 kilometer persegi ini terletak pada koordinat 6°18′6.8″LS,106°53′47.2″BT"",Taman Hiburan,Jakarta,10000,45,,""{'lat': -6.302445899999999, 'lng': 106.8951559}"",-63024459,1068951559,Jakarta Timur,0,Sunny,0";
"5,Atlantis Water Adventure,""Atlantis Water Adventure atau dikenal dengan Atlantis Ancol akan menyuguhkan petualangan wisata air tak terlupakan. Tempat Wisata bertemakan permainan air dengan luas 5 hektar ini memberi sensasi petualangan di 8 kolam utama. Yaitu kolam Antila, Plaza Atlas, Poseidon, Aquarius, Octopus, Kiddy Pool, dan Atlantean. Berlokasi di kawasan Ancol Jakarta Baycity, Atlantis bisa menjadi pilihan destinasi yang pas untuk wisata berenang."",Taman Hiburan,Jakarta,94000,45,60,""{'lat': -6.12419, 'lng': 106.839134}"",-612419,106839134,Jakarta Utara,1,Sunny,0";
"6,Taman Impian Jaya Ancol,Taman Impian Jaya Ancol merupakan sebuah objek wisata di Jakarta Utara.\n\n,Taman Hiburan,Jakarta,25000,45,10,""{'lat': -6.117333200000001, 'lng': 106.8579951}"",-61173332,1068579951,Jakarta Utara,0,Sunny,0";
"7,Kebun Binatang Ragunan,""Kebun Binatang Ragunan adalah sebuah kebun binatang yang terletak di daerah Ragunan, Pasar Minggu, Jakarta Selatan, Indonesia. Kebun binatang seluas 140 hektare ini didirikan pada tahun 1864. Di dalamnya terdapat berbagai koleksi yang terdiri dari 295 spesies dan 4040 spesimen.\nRagunan sempat ditutup selama sekitar tiga minggu sejak 19 September 2005 karena hewan-hewan di dalamnya ada yang terinfeksi flu burung, tetapi dibuka kembali pada 11 Oktober 2005.Kebun binatang ini memiliki banyak spesies hewan yang langka antara lain kakatua, orangutan, gorila, anoa dan gajah"",Cagar Alam,Jakarta,4000,45,,""{'lat': -6.3124593, 'lng': 106.8201865}"",-63124593,1068201865,Jakarta Selatan,0,Sunny,0";
"8,Ocean Ecopark,""Ocean Ecopark Salah satu zona rekreasi Ancol yang menawarkan ruang terbuka hijau serta pengalaman dan tidak melupakan sisi pendidikan bagi para pengunjung. Beragam aktivitas dan wahana seru yang bisa dimainkan di tempat rekreasi keluarga, beberapa diantaranya : Outbondholic, Rumah Energy, Rumah Lebah, Kano, Paintball, Outbondholic, Eco-Market, Learning Farm, Eco-Bike, Faunaland. Kalau berencana berwisata ke Ocean Eco Park ancol tidak perlu khawatir dengan harga tiket masuknya. Karena harga tiket masuk Ocean Eco Park ditawarkan dengan harga yang masih terjangkau."",Taman Hiburan,Jakarta,180000,4,,{'lat': -6.125801699999999, 'lng': 106.8363249}"",-61258017,1068363249,Jakarta Utara,1,Sunny,1";
"9,Pelabuhan Marina,""Pelabuhan Marina Ancol berada di kawasan Taman Impian Jaya Ancol, Jakarta. Pelabuhan yang biasa disebut Dermaga Marina Ancol ini adalah kawasan yang tidak hanya untuk keperluan penyeberangan saja, tetapi juga dikembangkan untuk banyak hal, seperti wisata air, olahraga air maupun wahana bermain. Fungsi utama dari pelabuhan ini adalah untuk melayani para penumpang yang ingin menyeberang menuju ke kepulauan Seribu, begitu juga sebaliknya. Banyak orang yang berada di Jakarta dan sekitarnya, menjadikan kepulaun Seribu sebagai tujuan wisata yang utama. Liburan di Pulau Seribu memang mampu menghilangkan kepenatan bekerja di kota metropolitan, sembari menikmati keindahan pantai yang masih terjaga dengan baik. Marina Ancol berada di Jakarta Utara atau secara lengkap beralamat di Kota Tua, Ancol, Pademangan, Kota Jakarta. Sangat mudah menuju ke tempat ini karena tidak terlalu jauh dari pusat kota. Selain itu, ada banyak transportasi umum yang menuju ke tempat ini atau bisa juga menggunakan jasa transportasi online."",Bahari,Jakarta,175000,44,,""{'lat': 1.07888, 'lng': 103.931398}"",107888,103931398,Jakarta Utara,1,Sunny,0";
"10,Pulau Tidung,""Pulau Tidung adalah salah satu kelurahan di kecamatan Kepulauan Seribu Selatan, Kabupaten Kepulauan Seribu, Jakarta, Indonesia."",Bahari,Jakarta,150000,45,,""{'lat': -5.803205300000001, 'lng': 106.5237907}"",-58032053,1065237907,Kepulauan Seribu,1,Sunny,0";
"11,Pulau Bidadari,""Pulau Bidadari merupakan salah satu resor di Kabupaten Kepulauan Seribu, Jakarta. Sebelum bernama Pulau Bidadari, pulau ini memiliki dua nama yaitu Pulau Sakit dan Pulau Purmerend"",Bahari,Jakarta,5000,46,,""{'lat': -6.035832999999999, 'lng': 106.746944}"",-6035833,106746944,Kepulauan Seribu,0,Sunny,0";
"12,Pulau Pari,""Pulau Pari adalah sebuah pulau yang terletak di Kepulauan Seribu di Daerah Khusus Ibukota Jakarta, Indonesia."",Bahari,Jakarta,150000,4,,{'lat': -5.9074328, 'lng': 106.5863989}"",-59074328,1065863989,Kepulauan Seribu,1,Sunny,1";
"13,Pulau Pramuka,Pulau Pramuka merupakan salah satu pulau yang berada dalam gugusan Kepulauan Seribu. Pulau ini merupakan pusat administrasi dan pemerintahan Kabupaten Administrasi Kepulauan Seribu. Pulau Pramuka termasuk ke dalam wilayah Kelurahan Pulau Panggang.,Bahari,Jakarta,5000,42,,""{'lat': -5.745962, 'lng': 106.6136577}"",-5745962,1066136577,Kepulauan Seribu,0,Sunny,1";
"14,Pulau Pelangi,""Pulau Pelangi adalah sebuah pulau yang terletak di Kepulauan Seribu di Daerah Khusus Ibukota Jakarta, Indonesia. Pulau Pelangi adalah sebuah pulau yang terletak di Kepulauan Seribu di Daerah Khusus Ibukota Jakarta, Indonesia, Pulau Pelangi / biasa disebut Pulau Petondan Besar ( Pelangi Island ) merupakan pulau resort yang sesuai untuk berlibur. Pulau Resort ini mempunyai konsep natural, karena sebagian wilayahnya di penuhi dengan rerimbunan pohon yang menyejukan mata, Keindahan alam dan lautnya layak untuk dikunjungi. Dikelilingi oleh rimbunan pohon dan laut berwarana biru jernih membuat suasanan sejuk dan nyaman. Kondisi yang ideal untuk wisata bersama keluarga. Dengan akomodasi yang langsung menghadap ke laut membuat turis betah berlama-lama di Pulau Pelangi.\nMenurut informasi, Pulau Pelangi atau Pulau Petondan Besar merupakan pulau yang berada pada gugusan Kepulauan Seribu. Secara administratif termasuk dalam wilayah Kabupaten Administratif Kepulauan Seribu provinsi DKI Jakarta. Bersamaan dengan Pulau Petondan Kecil merupakan sebuah resort berlibur. Letaknya berdekatan dengan gugusan yang sama dengan Pulau Kelor dan Pulau Kelapa.\nUntuk mencapai Pelangi Resort dibutuhkan waktu 90 menit perjalanan dari dermaga Pantai Mutiara. Terdapat kapal speedboat khusus di pier R1 Pantai Mutiara yang membawa penumpang kesana. Letaknya 60 – 70 km dari Pantai Mutiara memang lumayan jauh. Namun perjalanan anda terbayar lunas begitu sampai di Pulau Pelangi.";
",Bahari,Jakarta,900000,48,,{'lat': -5.587055, 'lng': 106.5885}"",-5587055,1065885,Kepulauan Seribu,1,Sunny,0";
"15,Pasar Seni,""Pasar Seni merupakan Pusat kerajinan dan kesenian yang menjadi wadah bagi seniman berbakat untuk menyalurkan kerajinan seni yang mereka miliki. Seniman dapat bertemu dengan para kolektor seni dan pengusaha untuk saling berbagi informasi dan memasarkan produk yang dimiliki. Didirikan awal tahun 1977, dengan peletakan batu pertama oleh Bang Ali Sadikin, Gubernur pertama DKI Jakarta, tepatnya pada bulan Juli 1977. Dan diresmikan oleh Gubernur H. Tjokropanolo pada tanggal 17 Desember 1977. Sejak diresmikan Pasar Seni, mendapat sambutan positif bagi pada pecinta seni yang ada."",Pusat Perbelanjaan,Jakarta,0,44,90,""{'lat': -6.1766868, 'lng': 106.8417666}"",-61766868,1068417666,Jakarta Pusat,0,Sunny,0";
"16,Jembatan Kota Intan,""Jembatan Kota Intan adalah jembatan tertua di Indonesia yang dibangun pada tahun 1628 oleh pemerintah Vereenigde Oostindische Compagnie atau VOC, atau masyarakat kita lebih familiar dengan sebutan Kumpeni. Jembatan itu kini terletak di Kali Besar kawasan Kota Tua wilayah Jakarta Barat dan berada di bawah pengelolaan Dinas Pariwisata dan Kebudayaan Provinsi DKI Jakarta."",Budaya,Jakarta,0,43,,""{'lat': -6.1314572, 'lng': 106.8106169}"",-61314572,1068106169,Jakarta Barat,0,Sunny,0";
"17,Museum Fatahillah,""Museum Fatahillah memiliki nama resmi Museum Sejarah Jakarta adalah sebuah museum yang terletak di Jalan Taman Fatahillah No. 1, Jakarta Barat dengan luas lebih dari 1.300 meter persegi.\nBangunan ini dahulu merupakan balai kota Batavia (bahasa Belanda: Stadhuis van Batavia) yang dibangun pada tahun 1707-1710 atas perintah Gubernur-Jendral Joan van Hoorn. Bangunan ini menyerupai Istana Dam di Amsterdam, terdiri atas bangunan utama dengan dua sayap di bagian timur dan barat serta bangunan sanding yang digunakan sebagai kantor, ruang pengadilan, dan ruang-ruang bawah tanah yang dipakai sebagai penjara. Pada tanggal 30 Maret 1974, bangunan ini kemudian diresmikan oleh bapak Ali Sadikin sebagai Museum Sejarah Jakarta."",Budaya,Jakarta,5000,44,,""{'lat': -6.136448899999999, 'lng': 106.8130661}"",-61364489,1068130661,Jakarta Barat,0,Sunny,0";
"18,Museum Bank Indonesia,""Museum Bank Indonesia adalah sebuah museum di Jakarta, Indonesia yang terletak di Jl. Pintu Besar Utara No.3, Jakarta Barat (depan stasiun Beos Kota), dengan menempati area bekas gedung Bank Indonesia Kota yang merupakan cagar budaya peninggalan De Javasche Bank yang beraliran neo-klasikal, dipadu dengan pengaruh lokal, dan dibangun pertama kali pada tahun 1828.\nPada tahun 1625, di tempat ini pernah dibangun sebuah gereja sederhana untuk umat Protestan. Pada tahun 1628, gereja ini dibongkar karena digunakan untuk tempat meriam besar ketika puluhan ribu tentara Sultan Agung menyerang Batavia untuk pertama kali.Museum ini menyajikan informasi peran Bank Indonesia dalam perjalanan sejarah bangsa yang dimulai sejak sebelum kedatangan bangsa barat di Nusantara hingga terbentuknya Bank Indonesia pada tahun 1953 dan kebijakan-kebijakan Bank Indonesia, meliputi pula latar belakang dan dampak kebijakan Bank Indonesia bagi masyarakat sampai dengan tahun 2005. Penyajiannya dikemas sedemikian rupa dengan memanfaatkan teknologi modern dan multi media, seperti display elektronik, panel statik, televisi plasma, dan diorama sehingga menciptakan kenyamanan pengunjung dalam menikmati Museum Bank Indonesia. Selain itu terdapat pula fakta dan koleksi benda bersejarah pada masa sebelum terbentuknya Bank Indonesia, seperti pada masa kerajaan-kerajaan Nusantara, antara lain berupa koleksi uang numismatik yang ditampilkan juga secara menarik.\nPeresmian Museum Bank Indonesia dilakukan melalui dua tahap, yaitu peresmian tahap I dan mulai dibuka untuk masyarakat (soft opening) pada tanggal 15 Desember 2006 oleh Gubernur Bank Indonesia saat itu, Burhanuddin Abdullah, dan peresmian tahap II (grand opening) oleh Presiden RI Susilo Bambang Yudhoyono, pada tanggal 21 Juli 2009.\nMuseum Bank Indonesia buka setiap hari kecuali Senin dan hari libur nasional."",Budaya,Jakarta,2000,47,,""{'lat': -6.137127, 'lng': 106.813005}"",-6137127,106813005,Jakarta Barat,0,Sunny,0";
"19,Kidzania,""KidZania adalah sebuah waralaba swasta Meksiko berupa pusat hiburan keluarga yang saat ini beroperasi di 23 lokasi, yang memungkinkan anak-anak melakukan pekerjaan orang dewasa dan mendapat bayaran. KidZania telah dikunjungi oleh lebih dari 31 juta pengunjung di seluruh dunia sejak pembukaannya, menjadikannya salah satu merek hiburan global yang paling cepat berkembang di dunia."",Taman Hiburan,Jakarta,185000,46,300,""{'lat': -6.225073499999999, 'lng': 106.8097144}"",-62250735,1068097144,Jakarta Selatan,1,Rain,0";
"20,Museum Taman Prasasti,""Museum Taman Prasasti adalah sebuah museum cagar budaya peninggalan masa kolonial Belanda yang berada di Jalan Tanah Abang No. 1, Jakarta Pusat. Museum ini memiliki koleksi prasasti nisan kuno serta miniatur makam khas dari 27 provinsi di Indonesia, beserta koleksi kereta jenazah antik. Museum seluas 1,2 ha ini merupakan museum terbuka yang menampilkan karya seni dari masa lampau tentang kecanggihan para pematung, pemahat, kaligrafer dan sastrawan yang menyatu."",Budaya,Jakarta,2000,45,90,{'lat': -6.172224099999998, 'lng': 106.8189695}"",-61722241,1068189695,Jakarta Pusat,0,Rain,0";
"21,Museum Wayang,""Museum Wayang adalah sebuah museum yang berlokasi di Jalan Pintu Besar Utara Nomor 27, Jakarta Barat."",Budaya,Jakarta,5000,45,150,""{'lat': -6.1349072, 'lng': 106.8124452}"",-61349072,1068124452,Jakarta Barat,0,Rain,0";
"22,Masjid Istiqlal,""Masjid Istiqlal (arti harfiah: Masjid Merdeka) adalah masjid nasional negara Republik Indonesia yang terletak di bekas Taman Wilhelmina, di Timur Laut Lapangan Medan Merdeka yang di tengahnya berdiri Monumen Nasional (Monas), di pusat ibukota Jakarta. Masjid ini merupakan salah satu dari 10 masjid terbesar kapasitasnya di dunia yang dapat menampung lebih dari 200.000 jamaah. Di seberang Timur masjid ini berdiri Gereja Katedral Jakarta. Ketua Harian Badan Pengelola Masjid Istiqlal (BPMI) sekaligus Imam Besar Masjid Istiqlal adalah Prof. Dr. Nasaruddin Umar, M.A. Pembangunan masjid ini diprakarsai oleh Presiden Republik Indonesia saat itu, Ir. Soekarno. Peletakan batu pertama sebagai tanda dimulainya pembangunan Masjid Istiqlal dilakukan oleh Ir. Soekarno pada tanggal 24 Agustus 1961. Arsitek Masjid Istiqlal adalah Frederich Silaban, seorang Nasrani.Masjid ini memiliki gaya arsitektur modern dengan dinding dan lantai berlapis marmer, dihiasi ornamen geometrik dari baja antikarat. Bangunan utama masjid ini terdiri dari lima lantai dan satu lantai dasar. Bangunan utama itu dimahkotai satu kubah besar berdiameter 45 meter yang ditopang 12 tiang besar. Menara tunggal setinggi total 96,66 meter menjulang di sudut Selatan selasar masjid. Masjid ini mampu menampung lebih dari 200.000 jamaah.Selain digunakan sebagai aktivitas ibadah umat Islam, masjid ini juga digunakan sebagai kantor berbagai organisasi Islam di Indonesia, aktivitas sosial, dan kegiatan umum. Masjid ini juga menjadi salah satu daya tarik wisata yang terkenal di Jakarta. Kebanyakan wisatawan yang berkunjung umumnya wisatawan domestik di samping sebagian wisatawan asing yang beragama Islam. Masyarakat non-Muslim juga dapat berkunjung ke masjid ini setelah sebelumnya mendapat pembekalan informasi mengenai Islam dan Masjid Istiqlal, meskipun bagian yang boleh dikunjungi kaum non-Muslim terbatas dan harus didampingi pemandu.\nPada tiap hari besar Islam seperti Ramadhan, Idul Fitri, Idul Adha, Tahun Baru Hijriyah, Maulid Nabi Muhammad serta Isra dan Mi'raj, Presiden Republik Indonesia selalu mengadakan kegiatan keagamaan di masjid ini yang disiarkan secara langsung melalui televisi nasional (TVRI) dan sebagian televisi swasta."",Tempat Ibadah,Jakarta,0,47,,""{'lat': -6.17017, 'lng': 106.83139}"",-617017,10683139,Jakarta Pusat,0,Sunny,0";
"23,Gereja Katedral,""Gereja Katedral Jakarta, atau bernama resmi Gereja Santa Maria Diangkat Ke Surga (bahasa Jerman: De Kerk van Onze Lieve Vrouwe ten Hemelopneming";" bahasa Inggris: The Church of Our Lady of the Assumption) adalah sebuah gereja di Jakarta. Gedung gereja ini diresmikan pada 1901 dan dibangun dengan arsitektur neo-gotik dari Eropa, yakni arsitektur yang sangat lazim digunakan untuk membangun gedung gereja beberapa abad yang lalu."",Tempat Ibadah,Jakarta,0,48,,""{'lat': -6.169225000000001, 'lng': 106.833063}"",-6169225,106833063,Jakarta Pusat,0,Sunny,0"
"24,Museum Nasional,""Museum Nasional Republik Indonesia atau Museum Gajah, adalah sebuah museum arkeologi, sejarah, etnografi, dan geografi yang terletak di Jakarta Pusat dan persisnya di Jalan Merdeka Barat 12. Museum ini merupakan museum pertama dan terbesar di Asia Tenggara."",Budaya,Jakarta,5000,46,,""{'lat': -6.176402099999999, 'lng': 106.8215901}"",-61764021,1068215901,Jakarta Pusat,0,Sunny,0";
"25,Pasar Tanah Abang,""Pasar Tanah Abang atau Pasar Sabtu dibangun oleh Yustinus Vinck pada 30 Agustus 1735. Yustinus Vinck mendirikan Pasar Tanah Abang Pasar atas izin dari Gubernur Jenderal Abraham Patramini. Izin yang diberikan saat itu untuk Pasar Tanah Abang adalah untuk berjualan tekstil serta barang kelontong dan hanya buka setiap hari Sabtu. Oleh karena itu, pasar ini disebut Pasar Sabtu. Pasar ini mampu menyaingi Pasar Senen (Welter Vreden) yang sudah lebih dulu maju.\nPada tahun 1740 terjadi Peristiwa Geger Pecinan, yaitu pembantaian orang-orang Tionghoa, perusakan harta benda, termasuk Pasar Tanah Abang diporakporandakan dan dibakar. Pada tahun 1881, Pasar Tanah Abang kembali dibangun dan yang tadinya dibuka pada hari Sabtu, ditambah hari Rabu, sehingga Pasar Tanah Abang dibuka 2 kali seminggu. Bangunan Pasar pada mulanya sangat sederhana,terdiri dari dinding bambu dan papan serta atap rumbia dari 229 papan dan 139 petak bambu. Pasar Tanah Abang terus mengalami perbaikan hingga akhir abad ke-19 dan bagian lantainya mulai dikeraskan dengan pondasi adukan. Pada tahun 1913, Pasar Tanah Abang kembali diperbaiki. Pada tahun 1926 pemerintah Batavia membongkar Pasar Tanah Abang dan diganti bangunan permanen berupa tiga los panjang dari tembok dan papan serta beratap genteng, dengan kantor pasarnya berada di atas bangunan pasar mirip kandang burung. Pelataran parkir di depan pasar menjadi tempat parkir kuda-kuda penarik delman dan gerobak. Di situ tersedia kobakan air yang cukup besar, dan di seberang jalan ada toko yang khusus menjual dedak makanan kuda. Beberapa puluh meter dari toko dedak ada sebuah gang yang dikenal sebagai Gang Madat, tempat lokalisasi para pemadat.\nPada zaman pendudukan Jepang, pasar ini hampir tidak berfungsi, dan menjadi tempat para gelandangan.\nPasar Tanah Abang semakin berkembang setelah dibangunnya Stasiun Tanah Abang. Di tempat tersebut mulai dibangun tempat-tempat seperti Masjid Al Makmur dan Klenteng Hok Tek Tjen Sien yang keduanya seusia dengan Pasar Tanah Abang. Pada tahun 1973, Pasar Tanah Abang diremajakan, diganti dengan 4 bangunan berlantai empat, dan sudah mengalami dua kali kebakaran, pertama tanggal 30 Desember 1978, Blok A di lantai tiga dan kedua menimpa Blok B tanggal 13 Agustus 1979. Pada tahun 1975 tercatat kiosnya ada 4.351 buah dengan 3.016 pedagang."",Pusat Perbelanjaan,Jakarta,0,4,45,""{'lat': -6.189009599999999, 'lng': 106.8119312}"",-61890096,1068119312,Jakarta Barat,0,Rain,1";
"26,Pecinan Glodok,""Kawasan Glodok yang dikenal sebagai pusat perdagangan elektronik sendiri dulunya merupakan bekas Penjara Glodok yang angker. Lokasi ini berada di seberang Glodok-Pancoran di kawasan Harco. Sebelum terjadi kerusuhan Mei 1998, kawasan ini sempat menjadi pusat belanja elektronik bagi wisatawan Jepang, Taiwan, dan Hongkong. Di Pinangsia, masyarakat bisa menemukan produk perlengkapan rumah tangga dan bangunan. Selain wisata belanja, pecinan Glodok-Pancoran juga merupakan situs sejarah awal mula Kota Jakarta. Setelah etnis Tionghoa bermukim dan membangun bisnis, serta perkebunan tebu, Batavia mulai berkembang pesat."",Pusat Perbelanjaan,Jakarta,0,43,20,""{'lat': -6.142758799999999, 'lng': 106.8140791}"",-61427588,1068140791,Jakarta Barat,0,Sunny,0";
"27,Sea World,""Seaworld Indonesia adalah sebuah miniatur pesona laut yang terdapat dalam kompleks wisata pertama di Taman Impian Jaya Ancol.\nPada tanggal 2 Oktober 1992, Gubernur DKI masa itu, Wiyogo Atmodarminto meletakkan batu pertama pembangunan Seaworld Indonesia. Tidak sampai dua tahun, pada tanggal 3 Juni 1994 SeaWorld Indonesia sudah mulai beroperasi. Area Seaworld seluas 3 hektare dengan luas bangunan utama 4.500 m2 berisi berbagai macam akuarium, lorong Antasena (lorong bawah air), perpustakaan, museum, terapi ikan dokter, glow theatre, komputer edukatif layar sentuh berisi informasi berbagai spesies di Seaworld dan bermacam fasilitas pelengkap untuk pengunjung seperti tempat makan, toko suvenir, dan ruang serba guna."",Taman Hiburan,Jakarta,115000,45,180,""{'lat': -6.126477500000001, 'lng': 106.842963}"",-61264775,106842963,Jakarta Utara,1,Rain,0";
"28,Wisata Agro Edukatif Istana Susu Cibugary,Kawasan Wisata Agro Edukatif Istana Susu “Cibugary” (Cibubur Garden Dairy ) merupakan suatu kawasan agro peternakan sapi perah bernuansa kebun dan taman. Wisata edukasi Cibubur Garden Dairy (CIBUGARY) merupakan salah wisata edukasi yang diminati siswa sekolah. Edukasi pengenalan peternakan sapi memberikan pengalaman yang tidak dapat dilupakan oleh siswa sekolah. Kegiatan edukasi yang tidak terlalu banyak dan menyenangkan ini sangat disukai siswa sekolah. Dengan berwisata edukasi ini dapat menambah ilmu dan pengalaman secara langsung bagi siswa sekolah. Paket wisata edukatif Istana Susu Cibugary dihargai antara Rp 35.000 sampai Rp 65.000 per orang. Harga tersebut sudah termasuk beberapa botol susu pasteurisasi dan goodybag cibugary.,Taman Hiburan,Jakarta,35000,45,,""{'lat': -6.3568093, 'lng': 106.9062371}"",-63568093,1069062371,Jakarta Timur,0,Sunny,0";
"29,Wisata Kuliner Pecenongan,""Pecenongan merupakan salah satu surga kuliner di Jakarta Pusat yang dikenal sejak zaman Jakarta masih bernama kota Batavia. Dulunya di kawasan ini terdapat pedagang kaki lima yang menjajakan kuliner di pinggir jalan, tetapi tahun demi tahun kawasan Pecenongan semakin ramai dengan adanya rumah makan-rumah makan yang mulai dibangun. Kawasan pecenongan ini cocok bagi kalian yang ingin berwisata kuliner dimalam hari, beragam jenis kuliner yang pastinya membuat kamu kebingungan ingin mencoba yang mana terlebih dahulu. Tak heran jika orang yang sudah pernah mencoba pergi kulineran ke sini pasti akan kembali lagi."",Pusat Perbelanjaan,Jakarta,0,5,,{'lat': -6.166788700000001, 'lng': 106.8265261}"",-61667887,1068265261,Jakarta Pusat,0,Sunny,0";
"30,Taman Menteng,""Taman Menteng adalah sebuah taman yang berlokasi di kawasan Menteng, Jakarta Pusat. Taman ini dulunya ditempati oleh Stadion Menteng.\nTaman ini berdiri di atas lahan seluas 2,9 hektar, dan memiliki koleksi 30 spesies tanaman yang berbeda. Taman Menteng juga memiliki beragam fasilitas pendukung seperti taman bermain untuk anak-anak serta lapangan futsal dan basket. Uniknya, di taman ini terdapat pula 44 sumur resapan untuk membantu penyerapan air hujan ke dalam tanah."",Taman Hiburan,Jakarta,0,45,,{'lat': -6.1964087, 'lng': 106.8293106}"",-61964087,1068293106,Jakarta Pusat,0,Sunny,0";
"31,Wisata Alam Mangrove Angke,""Jangan anggap di Jakarta tidak ada wisata alam. Langsung meluncur ke Jakarta Utara, tepatnya di Kamal Muara Penjaringan atau Pantai Indah Kapuk. Di daerah ini terdapat area wisata alam yaitu Taman Wisata Mangrove Jakarta yang sekarang dan beberapa tahun belakangan tengah hits. Di kawasan ini terdapat tiga area, satu berupa Suaka Margasatwa Muara Angke yang tertutup untuk umum, Hutan Mangrove milik Pemprov DKI tetapi kurang begitu menarik untuk wisata. Selanjutnya Taman Wisata Alam Mangrove Angke yang memang merupakan area wisata berbasis konservasi mangrove."",Cagar Alam,Jakarta,25000,43,,{'lat': -6.105334, 'lng': 106.735584}"",-6105334,106735584,Jakarta Utara,0,Sunny,0";
